title,body,language,date,source,url
أخبار اليوم | سكاي نيوز عربية,"القصة الرئيسية شرق أوسط إسرائيل تكثف قصف وتفجير المنازل والأبراج السكنية في غزة عالم عالم فيديو.. القوات الروسية تتسلل عبر نفق إلى كوبيانسك الأوكرانية شرق أوسط شرق أوسط الجيش اللبناني يتسلم 8 شاحنات من السلاح الفلسطيني شرق أوسط شرق أوسط ""لقد حسمنا الأمر"".. هاليفي: ضحايا غزة تجاوزوا 200 ألف شخص عالم عالم وسائل إعلام: لقاء ترامب ورئيس وزراء قطر حقق نتائج إيجابية آخر الأخبار شرق أوسط صحيفة أميركية: إسرائيل قصفت الدوحة بصواريخ من البحر الأحمر l قبل 6 دقائق علوم روسيا: تطلق قمرين اصطناعيين بواسطة الصاروخ سويوز 2.1 l قبل 3 ساعات شرق أوسط الحوثيون: أطقنا صاروخ باليستي متعدد الرؤوس على إسرائيل l قبل 4 ساعات عالم مقتل 12 جنديا باكستانيا في هجوم لطالبان باكستان l قبل 5 ساعات عالم روسيا: تدمير مسيرات أوكرانية واستسلام ضباط مخابرات أوكرانيون l قبل 5 ساعات عالم روسيا: توسع سيطرتها في دنيبروبتروفسك تسيطر على قرية جديدة l قبل 2 ساعة زوارنا يتصفحون الآن شرق أوسط إسرائيل تستعد لـ""تهجير الفلسطينيين"" جوا وبحرا.. وطلب لمصر l 12 سبتمبر 2025 شرق أوسط أول رد إسرائيلي على القرار الأممي بشأن ""حل الدولتين"" l قبل 18 ساعة شرق أوسط 22 دولة رفضت أو امتنعت عن التصويت لـ""حل الدولتين"".. ما هي؟ l قبل 19 ساعة أخبار الاقتصاد اقتصاد عالمي ذروة الطلب على النفط.. بين وهم التراجع وواقع الصعود المستمر طاقة أوبك في عامها الـ65: تاريخ حافل ورؤية لمستقبل ناجح ذكاء اصطناعي هل أصبح ""الجيل زد"" مهندسي المستقبل في مكاتب اليوم؟ أخبار لبنان خدمات الإنترنت الفضائي من ""ستارلينك"" قريباً في لبنان فيديو شرق أوسط تحذيرات إقليمية من تداعيات تصعيد إسرائيل على استقرار المنطقة يعرض الآن شرق أوسط شرق أوسط 12 سبتمبر 2025 تحذيرات إقليمية من تداعيات تصعيد إسرائيل على استقرار المنطقة يعرض الآن عالم عالم 12 سبتمبر 2025 وزارة الدفاع التركية تصعِّد خطابها تجاه إسرائيل يعرض الآن عالم عالم 12 سبتمبر 2025 بولندا تغلق حدودها مع بيلاروسيا يعرض الآن شرق أوسط شرق أوسط 12 سبتمبر 2025 خبراء: الغارات الإسرائيلية قد تعيق قدرات الحوثيين ""مؤقتا"" يعرض الآن شرق أوسط شرق أوسط 12 سبتمبر 2025 مصادرنا: انزعاج أميركي من الضربة الإسرائيلية على الدوحة شرق أوسط إسرائيل تعلن اعتراض صاروخ أُطلق من اليمن أعلنت إسرائيل، السبت، اعتراض صاروخ أُطلق من اليمن، بعد ",Arabic,,skynewsarabia.com,https://www.skynewsarabia.com/
"Slashdot: News for nerds, stuff that matters","Slashdot Stories Firehose All Popular Polls Software Thought Leadership Submit Search Slashdot Login or Sign up Topics: Devices Build Entertainment Technology Open Source Science YRO Follow us: RSS Facebook LinkedIn Twitter Youtube Mastodon Bluesky Bluesky Become a fan of Slashdot on Facebook Nickname: Password: Public Terminal Forgot your password? Close binspam dupe notthebest offtopic slownewsday stale stupid fresh funny insightful interesting maybe offtopic flamebait troll redundant overrated insightful interesting informative funny underrated descriptive typo dupe error MongoDB Atlas: Multi-cloud, modern database on AWS, Azure, and Google Cloud. Get access to our most high performance version ever, with faster and easier scaling at lower cost. × 179195538 story E-Bike Injuries Are a Massive Burden, Say Surgeons 8 Posted by BeauHD on Saturday September 13, 2025 @06:00AM from the risks-and-rewards dept. Surgeons in London report a surge in severe e-bike-related injuries, putting major strain on NHS trauma units . The BBC mentions a couple e-bike accidents overheard at the Royal London Hospital in Whitechapel. ""A 32-year-old, fit and well student... a couple of days ago he fell off an e-bike sustaining a closed left tibial plateau fracture."" Another case involved a little girl named Frida: ""Six-year-old girl, she was hit by an electric bike, she has a closed tib/fib fracture."" From the report: Surgeon Jaison Patel is seeing more and more cases like this. ""It's a massive burden on our department and I'm sure it's the same across the whole of London,"" he tells us. ""If we can reduce the number of patients coming in with these sorts of injuries it would be great for the patients obviously, but also takes massive pressure off us in the NHS."" Jaison deals with lower limb injuries. Just along the corridor his colleague Nick Aresti does the upper limbs. Nick explains that he is a cyclist himself, and it's something he encourages people to do for the benefit of their healt",English,"on Saturday September 13, 2025 @06:00AM",slashdot.org,https://slashdot.org/
"Latest news, sport and opinion from the Guardian","News Hide Charlie Kirk shooting Widow of Charlie Kirk says her ‘cries will echo around the world like a battle cry’ In statement Friday, Erika Kirk says ‘evildoers responsible for my husband’s assassination have no idea what they have done’ 5h ago Live updates Charlie Kirk’s US campus tour will continue despite his death, widow says US Several people fired after clampdown on speech over Charlie Kirk shooting ‘He changed the ground game’ Charlie Kirk’s outsize influence on the Maga movement Donald Trump Trump declines to call for unity after Charlie Kirk killing in stunning move Gaza ‘We took the gloves off’: ex-IDF chief confirms Gaza casualties over 200,000 Retired general Herzi Halevi says ‘not once’ had legal advice constrained Israel’s military decisions in the strip Film ‘We do not agree’: Paramount criticizes Israeli film industry boycott Analysis Israel’s strike on Hamas leaders in Qatar shatters Gulf’s faith in US protection Europe Nato announces more air support to defend Poland against future Russian incursions Russia-Ukraine war at a glance Ukraine war briefing: Poland’s allies decry ‘flagrant violation’; Warsaw sends troops to border to monitor Belarus drills Sweden ‘There are hundreds in the Baltic’: tracking Russia’s ‘shadow fleet’ of oil tankers Israel Universities around the world cut ties with Israeli academia over Gaza war 5h ago Skating British ice dancer and same-sex skating partner to compete in Finland after rule change 7h ago UK news US actor battles UK council over restoration of ‘Downton Shabby’, his ancestral home 17m ago Live World Athletics Championships: 100m heats, women’s 10,000m final and more on night one Rolling report: Join John Brewin for updates from the first evening session in Tokyo 8m ago US universities University of California, Berkeley shares 160 names with Trump administration in ‘McCarthy era’ move Golf John Daly claims unwanted slice of golf history with record 19 on single hole 5h ago Special report Hide The Saturday re",English,2025-09-13T05:59:33.000Z,theguardian.com,https://www.theguardian.com/international
"The National - Latest world news, sport & opinion","International Edition International Edition UAE Edition My Profile Saved articles Sign out Register Sign in Register Sign in News UAE Gulf MENA US UK Europe Asia Business Aviation Economy Energy Money Property Banking Markets Opinion Comment Editorial Obituaries Cartoon Feedback Future Science Space Technology Climate Environment Road to Net Zero Health Culture Art & Design Books Film & TV Music & On-stage Pop Culture Lifestyle Travel Fashion & Beauty Food Motoring Luxury Home & Garden Wellbeing Things to do Sport Football Cricket F1 Tennis Combat Sports Horse Racing Israel-Gaza war Weekend TN Magazine International Edition International Edition UAE Edition Podcasts Newsletters Follow us Alerts App Video Israel-Gaza war Weekend TN Magazine News UAE Gulf MENA US UK Europe Asia Business Aviation Economy Energy Money Property Banking Markets Opinion Comment Editorial Obituaries Cartoon Feedback Future Science Space Technology Climate Environment Road to Net Zero Health Culture Art & Design Books Film & TV Music & On-stage Pop Culture Lifestyle Travel Fashion & Beauty Food Motoring Luxury Home & Garden Wellbeing Things to do Sport Football Cricket F1 Tennis Combat Sports Horse Racing News UAE Gulf MENA US UK Europe Asia Business Aviation Economy Energy Money Property Banking Markets Opinion Comment Editorial Obituaries Cartoon Feedback Future Science Space Technology Climate Environment Road to Net Zero Health Culture Art & Design Books Film & TV Music & On-stage Pop Culture Lifestyle Travel Fashion & Beauty Food Motoring Luxury Home & Garden Wellbeing Things to do Sport Football Cricket F1 Tennis Combat Sports Horse Racing Weekend edition Can Moroccan bricklayer's daughter Rachida Dati rebuild career as Paris's mayor? Find out how well you’ve kept up with the news of the past seven days How 4,000 tonnes of British grit got the Abu Dhabi Grand Prix on track Washington soldiers on - but residents grow weary of Trump's military presence The Palestinian photographer focuse",English,"Sat, 13 Sep 2025 11:19:22 GMT",thenationalnews.com,https://www.thenationalnews.com/
Vox,"Skip to main content The homepage Vox Vox logo Explainers Politics Culture Advice Listen Podcast Watch Video Menu The homepage Vox Vox logo Navigation Drawer Login / Sign Up close Close Search Video Watch Podcast Listen Crossword Play Explainers Politics Culture Advice Science Technology Climate Health Money Life Future Perfect Newsletters Become a Member Facebook Instagram Youtube RSS TikTok Making sense of it all: The Trump administration Political violence Immigration news Climate This moment demands more than headlines In a time of noise, confusion, and spin, we’re committed to clarity, truth, and depth — even when it’s hard. That kind of journalism isn’t easy. We rely on readers like you to fund our journalism. Will you support our work and become a Vox Member today? Join now Politics How Charlie Kirk remade Gen Z ﻿Three reasons his message resonated so strongly with young conservatives. By Christian Paz Politics How Charlie Kirk remade Gen Z ﻿Three reasons his message resonated so strongly with young conservatives. By Christian Paz Politics Let’s be honest about Charlie Kirk’s life — and death Politics Democrats are on the verge of a dangerous mistake Down to Earth The most miraculous animal migration is happening in the middle of New York City Future Perfect How to save Social Security without screwing over poor people Politics How to mourn in our polarized age Top links Crossword Solve the crossword Play Vox’s daily puzzle! Play Newsletters Explainers in your inbox Sign up Vox Our Mission Help you understand what really matters About Vox Even Better More You’re paying too much for your phone By Adam Clark Estes What do I do about my family’s vaccinations now? By Dylan Scott This counterintuitive advice about kids and phones makes a lot of sense By Adam Clark Estes The Highlight Why are single men so miserable? By Allie Volpe ChatGPT isn’t just for cheating anymore By Adam Clark Estes You’re paying too much for your phone By Adam Clark Estes What do I do abou",English,2025-09-12T11:30:00+00:00,vox.com,https://www.vox.com/
"WIRED - The Latest in Technology, Science, Culture and Business | WIRED","Skip to main content Menu SECURITY POLITICS THE BIG STORY BUSINESS SCIENCE CULTURE REVIEWS Menu Account Account Newsletters Security Politics The Big Story Business Science Culture Reviews Chevron More Expand The Big Interview Magazine The New Era of Business Travel Events WIRED Insider WIRED Consulting Newsletters Podcasts Video Merch Search Search Sign In Sign In WIRED Today’s Picks Game On Bullets Found After the Charlie Kirk Shooting Carried Messages. Here’s What They Mean The inscriptions on bullets recovered near the scene of Charlie Kirk’s murder appear to reference video games like Helldivers 2 and online furry roleplay, not a legible political ideology. Mute Force Cancel Culture Comes for Artists Who Posted About Charlie Kirk’s Death Extremism Extremist Groups Hated Charlie Kirk. Now They’re Using His Death to Radicalize Others Tech Titanic The Superyacht, the Billionaire, and a Wildly Improbable Disaster at Sea Merge Right The Free Ride for EVs in the Carpool Lane Is Coming to an End Navel Gazing Lee Pace Has Big Hopes for Foundation ’s Fourth Season Most Recent Featured Events Join Us for WIRED’s AI Power Summit On September 15, WIRED is gathering a panel of leaders across technology, politics, and media to tell you everything you need to know about the future of generative AI. Big Businesses Are Doing Carbon Dioxide Removal All Wrong The 25 Best Shows on Amazon Prime Right Now Jeffrey Epstein’s Yahoo Inbox Revealed Gear News of the Week: Google’s Next-Gen Nest Cams Are Coming, and Sony Debuts a New Xperia Phone Save $70 on One of Our Favorite Android Tablets Subscriber Exclusives Backchannel I Wasn’t Sure I Wanted Anthropic to Pay Me for My Books—I Do Now Anthropic agreed to a $1.5 billion settlement for authors whose books were used to train its AI model. As an author who fits that description, I’ve come around to the idea. Made in China How China’s Propaganda and Surveillance Systems Really Operate AI Lab Microsoft’s AI Chief Says Machine Consciousness",English,,wired.com,https://www.wired.com/
