title,body,language,date,source,url
الرئيسية - BBC News عربي,"BBC News, عربي إذهب الى المحتوى أقسام الصفحة الحالية, رئيسية شاهد البث المباشر أخبار اقتصاد صحة وعلوم رياضة فيديو تحقيقات بودكاست برامجنا الصفحة الحالية, رئيسية شاهد البث المباشر أخبار اقتصاد صحة وعلوم رياضة فيديو تحقيقات بودكاست برامجنا BBC News , عربي - الرئيسية الخبر الرئيسي قمة عربية إسلامية في الدوحة الأثنين، والجيش الإسرائيلي يعلن نزوح أكثر من 250 ألف شخص من مدينة غزة تشهد الدوحة الاثنين قمة عربية إسلامية طارئة لبحث الهجوم الإسرائيلي على قطر، ولقاء بين الرئيس الأميركي دونالد ترامب ورئيس الوزراء القطري في نيويورك، بعد محاولة اغتيال إسرائيلية لقادة من حماس في الدوحة أثارت استياء واشنطن. قبل 13 دقيقة هل ينقل الهجوم الإسرائيلي على قطر العلاقات الخليجية-الإسرائيلية إلى مرحلة مختلفة تماماً؟ الهجوم الإسرائيلي، الذي استهدف قيادات من حركة حماس أثناء وجودهم في العاصمة القطرية، لم يُقرأ خليجياً فقط باعتباره تطوراً عسكرياً خطيراً، بل كرسالة سياسية مباشرة تمس أمن دول مجلس التعاون مجتمعة. قبل 4 ساعة ""ليس لأننا لا نخاف الموت ولكن لأننا لا نقدر على ثمن النزوح"": التكلفة تجبر الغزيين على تجاهل إنذارات الإخلاء تساقطت على سكان مدينة غزة صباح الثلاثاء 9 سبتمبر/ أيلول منشورات إسرائيلية تطالبهم بإخلاء المدينة استعدادا لعملية عسكرية وصفها وزير الدفاع الإسرائيلي يسرائيل كاتس بـ""الإعصار المدوي"". لكن عددا كبيرا من نحو مليون شخص هناك لا يستطيعون النزوح لتكلفته الباهضة التي تزيد كلما اشتدت الحاجة. قبل 5 ساعة أحمد الشرع: نتفاوض مع إسرائيل حول اتفاق أمني، وروسيا انسحبت خلال إسقاط الأسد بالاتفاق معنا تحدّث الرئيس السوري للمرحلة الانتقالية، أحمد الشرع، خلال مقابلة تلفزيونية، عن مواضيع متعددة، شملت المفاوضات مع إسرائيل، والعلاقات مع روسيا وإيران، وقضية السويداء، وقوات قسد. قبل 8 ساعة نيبال تشهد تعيين أول سيدة كرئيسة وزراء في تاريخها بعد احتجاجات ""جيل زد"" التي أطاحت بالحكومة احتجاجات شعبية حاشدة تسقط حكومة نيبال وتأتي برئيسة المحكمة العليا السابقة لتشكيل حكومة جديد. 13 سبتمبر/ أيلول 2025 ما نعرفه عن تايلر روبنسون، المشتبه به في قتل تشارلي كيرك ألقت السلطات الأمريكية القبض على تايلر روبنسون، البالغ من العمر 22 عاماً، بتهمة قتل الناشط اليميني البارز تشارلي كيرك بالرصاص خلال فعالية في جامعة يوتا ف",Arabic,2025-09-13,bbc.com,https://www.bbc.com/arabic
Bloomberg - Are you a robot?,Why did this happen? Please make sure your browser supports JavaScript and cookies and that you are not blocking them from loading. For more information you can review our Terms of Service and Cookie Policy . Need Help? For inquiries related to this message please contact our support team and provide the reference ID below. Block reference ID:7e36eab4-9093-11f0-ac0e-7ecc93cae6c2 Get the most important global markets news at your fingertips with a Bloomberg.com subscription. SUBSCRIBE NOW,English,,bloomberg.com,https://www.bloomberg.com/
"CNET: Product reviews, advice, how-tos and the latest news","X Your Guide To a Better Future CNET News AI Tech VPN Phones Laptops Audio TV Services & Software Computers All Tech Home Home Security Smart Home Kitchen & Household Yard & Outdoors Home Internet All Home Entertainment Gaming TV & Movies Streaming All Entertainment Wellness Sleep Nutrition Fitness Personal Care All Wellness Cover Stories More Money CNET Video Editors' Choice All More Back Today's Highlights 01 Apple Debuts the iPhone Air, AirPods 3 and More 02 I Tested iOS 26 for 3 Months and Liquid Glass Isn't the Only Game-Changing Feature 03 Super Mario Galaxy Movie, Mario Tennis Fever and More Coming for Mario's 40th Anniversary 04 iPhone 17 Pro: 8x Zoom, A19 Pro Chip for $1,099 05 iPhone 17 Preorders Are Live: Here's How to Get One for Free at Launch 06 AirPods Pro 3 Translate Conversations Live in Your Ear 07 No, Your iPhone Isn't Listening to You. It's Worse 08 Best VPN 2025: Top 5 Services Tested 09 Top 100 Channels on Live TV Streaming Services: YouTube TV, Hulu Live and More AI ChatGPT 3.5 Review: First Doesn't Mean Best OpenAI Dall-E 3 Review: Generative AI for Fanciful, Fun Illustrations Microsoft Copilot Chatbot Review: Bing Is My Default Search Engine Now Hidden AI Features Available on Your Apple Watch Right Now Wellness 9 Best Yoga Poses for Your Ultimate Night's Sleep 10 Simple Ways to Protect Your Eye Health Each Day Apple Cider Vinegar: Here's What to Know About Health Benefits, Proper Dosage and More 7 Simple Happiness Hacks to Help You Control Your Mood Back Tech Whatever tech you're after, we'll help you save on it. Explore all Best VPN Deals Best Gifts Under $300 Apple Deals iPad MacBook AirPods iPhone TV & Audio Deals TV Roku Sonos Streaming Gaming Deals Xbox PS5 Nintendo Switch Gaming PCs Back Home Give your home an upgrade or snag some everyday essentials without breaking the bank. Explore all Best Electric Lawn Mower Deals Best Amazon Deals Smart Home Deals Smart Home Home Security Robot Vacuum Smart Thermostat Equipment Deals Portable AC",English,"Sat, 13 Sep 2025 11:15:21 GMT",cnet.com,https://www.cnet.com/
Новости России — последние и главные новости сегодня на этот час,"Перейти к содержанию Search for: Конвертер валют Новости Происшествия Москва Тесты Магнитные бури Топы Избирательные участки открылись в Москве: важные события на местах народного притяжения 13.09.2025 Как создавался гимн Москвы «Дорогая моя столица»: история создания и интересные факты 13.09.2025 Палач стал жертвой: как пытатель попал в собственную ловушку 13.09.2025 НАТО не смогло сбить ни одного из 5 российских дронов: анализ дырявой обороны 13.09.2025 Бразилия приговорила друга Трампа Болсонару к 27 годам тюрьмы: пожизненное заключение по сути 13.09.2025 Топ-10 самых популярных мужских имен в России в 2025 году 13.09.2025 10 антистрессовых перекусов от диетолога Залетовой для поднятия настроения 13.09.2025 Возобновление рейсов из Краснодара в Анталью с сентября 2023: расписание и актуальные цены 13.09.2025 5 внедорожников, которые стали символами надежности в послевоенное время 13.09.2025 Тельцам пора расслабиться, а Весам стоит сосредоточиться на отношениях 13.09.2025 Их выбрали на небесах: знак зодиака, которому везет больше остальных 13.09.2025 Убийца Кирка: эксперты раскрывают подставу за преступлением 13.09.2025 Сериал «Отпечатки» на Kion: дата выхода, график серий и что ожидать от нового сезона 13.09.2025 Когда ожидать первый снег: синоптики предсказывают неожиданное наступление зимы 13.09.2025 Авария на Кутузовском проспекте: движение затруднено, обновления и рекомендации для водителей 13.09.2025 Поиск сбежавшего осужденного под Ульяновском: правоохранители активизировали действия 13.09.2025 Самые популярные женские имена в России в 2025 году: топ выборов родителей 13.09.2025 Оптимальное количество рыбы для укрепления иммунитета: рекомендации и советы 13.09.2025 Польские военные направляются на Украину: заявление Туска о новых вызовах 13.09.2025 Признаки грибного отравления: что нужно знать для безопасности 13.09.2025 Как подготовиться к 6 дням магнитных бурь: советы врача Спахова для сохранения здоровья 13.09.2025 Еда, которая существенно влияет на урове",English,2025-09-13,ritmmsk.ru,https://ritmmsk.ru/
Engadget | Technology News & Reviews,"Advertisement Advertisement Advertisement Metroid Prime 4: Beyond will be released on December 4 for Switch and Switch 2 Nintendo's latest console gets an enhanced version. Lawrence Bonk a day ago Mario, Metroid, Virtual Boy and more: all the biggest announcements from today's Nintendo Direct Kris Holt 18 hours ago Nintendo is bringing back the Virtual Boy as a Switch and Switch 2 accessory Kris Holt 21 hours ago Everything Apple revealed at the iPhone 17 launch event: iPhone Air, iPhone 17 Pro, AirPods Pro 3 and more Valentina Palladino 09.09.2025 One year of Paramount+ is on sale for as low as $30 right now Anna Washenko 20 hours ago Apple iPhone 17 event Latest stories Cozy detectives, urban disc golf and other new indie games worth checking out Acclaim had a lot of neat stuff to reveal at its showcase this week. What to expect at Meta Connect 2025: 'Hypernova' smart glasses, AI and the metaverse Meta Connect, the company's annual event dedicated to all things AR, VR, AI and the metaverse is just days away. And once again, it seems like it will be a big year for smart glasses and AI. Instagram fixed an issue that caused posting multiple Stories to tank your reach Instagram fixed a bug that made posting multiple Stories in a day hurt the reach of your Stories overall. Balatro's big 2025 update won't be coming out this year after all Developer LocalThunk just revealed that the Balatro 1.1 update will not be coming in 2025. It will, however, be free on all platforms. The best iPad deals you can get right now include the iPad A16 for $299 Here are the best iPad deals we could find -- along with a few other Apple deals we spotted. Mario, Metroid, Virtual Boy and more: all the biggest announcements from today's Nintendo Direct Who's ready for more Donkey Kong Bananza? (Yes, already.) Fire Emblem: Fortune's Weave comes out for the Switch 2 in 2026 Fire Emblem: Fortune's Weave will hit the Nintendo Switch 2 in 2026. It's the next installment in the long-running tactical ",English,,engadget.com,https://www.engadget.com/
Financial Times,"Accessibility help Skip to navigation Skip to content Skip to footer Visit Markets Data Sign In Subscribe Open side navigation menu Open search bar Financial Times Subscribe Sign In Search the FT Search Close search bar Close Home Markets Data Home World Sections World Home Middle East war Global Economy UK US China Africa Asia Pacific Emerging Markets Europe War in Ukraine Americas Middle East & North Africa Most Read US authorities arrest suspect in Charlie Kirk assassination What we know about the suspect in the shooting of Charlie Kirk Fed governor Lisa Cook listed contested home as vacation property America’s dangerous descent into mutual loathing US urged UK to offer better drug pricing deal to pharma companies US Sections US Home US Economy US Companies US Politics & Policy Most Read US authorities arrest suspect in Charlie Kirk assassination What we know about the suspect in the shooting of Charlie Kirk Fed governor Lisa Cook listed contested home as vacation property America’s dangerous descent into mutual loathing US urged UK to offer better drug pricing deal to pharma companies Companies Sections Companies Home Energy Financials Health Industrials Media Professional Services Retail & Consumer Tech Sector Telecoms Transport Most Read US urged UK to offer better drug pricing deal to pharma companies Giorgio Armani named three preferred buyers for empire in his will The strains on the private equity model are showing Stephen Schwarzman’s country estate hit by water tanker ban Larry Ellison, the tech world’s great survivor Tech Sections Tech Home Artificial intelligence Semiconductors Cyber Security Social Media Most Read Larry Ellison, the tech world’s great survivor US and UK near tech, nuclear and whisky deals ahead of Trump trip How chatbots are changing the internet AI ‘hit squad’ set up to drive Whitehall efficiency struggles to hire top talent Oracle’s astonishing jam-tomorrow OpenAI trade Markets Sections Markets Home Alphaville Markets Data Crypto Ca",English,2025-09-13T10:00:09+0000,ft.com,https://www.ft.com/
"HuffPost - Breaking News, Politics, Entertainment & Opinion","Skip to Main Content Main Menu U.S. Edition News U.S. News World News Business Environment Health Social Justice Crime Politics Congress Extremism Opinion Entertainment Culture & Arts Media Celebrity TV & Film Books Sports Life Wellness Travel Tech Style & Beauty Food & Drink Parenting Relationships Money Home & Living Work/Life Shopping Voices Black Voices Queer Voices Latino Voices Indigenous Voices Asian Voices Women's Voices HuffPost Personal NEW: Games Horoscopes Video Newsletters International U.S. U.K. España France Ελλάδα (Greece) Italia 日本 (Japan) 한국 (Korea) Follow Us Terms | Privacy Policy Part of HuffPost News. ©2025 BuzzFeed, Inc. All rights reserved. Trending Charlie Kirk Shooter's Shell Casings Don't Suggest 'Trans Ideology.' Here's What They Do Mean. Kash Patel's Use Of This 1 Word In Charlie Kirk Farewell Has Social Media Buzzing Meghan McCain's Post Claiming Left 'Glorifies Death' Doesn't Go Right For Her More Backlash To Charlie Kirk’s Killing Is Coming. It’s Going To Be Bad. Trump Rejects Opportunity To Unite Country In Wake Of Kirk Death: 'I Couldn't Care Less' ICE Officer Shoots, Kills Man Who Attempted To Flee Traffic Stop 24 Of The Funniest Posts About Cats And Dogs This Week Yet Another 'SNL' Cast Member Just Announced Her Exit — And This One Stings This Actor-Athlete Power Couple Just Called Off Their Engagement After 5 Years Together Trump Says U.S. Criminal Justice System Should Work More Like China's Charlie Kirk Shooting Suspect Captured, Trump And Utah Authorities Announce 'It's All Of Our Faults': GOP Senator Calls For Political Unity On CNN In Wake Of Kirk Death HUFFPOST NEWS POLITICS ENTERTAINMENT LIFE PERSONAL VOICES SHOPPING GAMES THE SUSPECT: FROM SCHOLARSHIP KID TO ACCUSED ASSASSIN KIRK'S WIDOW THUNDERS: 'YOU HAVE NO IDEA WHAT YOU HAVE UNLEASHED' SHOCK REPORT: KASH REVELED AT RITZY RESTAURANT AS HE BOTCHED SEARCH BULLET INSCRIPTIONS REVEALED AND DECODED... LATEST UPDATES... LATEST NEWS More Backlash To Charlie Kirk’s Killing Is C",English,,huffpost.com,https://www.huffpost.com/
"استشارات التحول الرقمي وتحليل البيانات والذكاء الاصطناعي - مسار - Digital Transformation, Data Analysis, and Artificial Intelligence Consultancy - Masaar",الرئيسية قصص النجاح الخدمات اتصل بنا مسار تدعم نمو أعمالك نساعدك على تبني أفضل الممارسات والمنهجيات في التحول الرقمي وتحليل البيانات والذكاء الاصطناعي للنمو بأعمالك. فلنبدأ! جميع الحقوق محفوظة - معلومات عن الموقع والبرمجيات الحرة ومفتوحة المصدر,English,,masaar.com,https://masaar.com
"The New York Times - Breaking News, US News, World News and Videos","Skip to content Skip to site index U.S. International Canada Español 中文 Today’s Paper New York Times - Top Stories How Law Enforcement Got the Man Suspected of Killing Charlie Kirk F.B.I. leaders touted the immense federal deployment assigned to find the assassin. But their big break came with a single tip — from the suspect’s own family. 6 min read The New York Times This Is the Path the Gunman Took to Get on Campus and Escape Charlie Kirk’s killer spent hours on the campus before climbing onto a roof amid a crowd, and he quickly escaped after the shooting. From Scholarship Winner to Wanted Man: The Life of the Kirk Shooting Suspect 5 min read Kirk Assassination Puts America’s Political Spotlight on Campuses Again 5 min read Advertisement SKIP ADVERTISEMENT Trump Administration Tariff Tracker Blunt-Force Diplomacy Crime Strategy Trump-Epstein Timeline Jordan Gale for The New York Times After Trump’s Cuts, ‘Crippled’ NPR and PBS Stations Must Transform Radio and TV stations, facing wide budget gaps, are pleading with NPR and PBS to lower fees as they examine whether to drop national programming altogether. 7 min read U.C. Berkeley Gives Names of Students and Faculty to Government for Antisemitism Inquiry 2 min read E.P.A. to Stop Collecting Emissions Data From Polluters 3 min read California’s $23 Billion Plan to Restore Federal Cuts to Scientific Research 4 min read Lawsuit Accuses Trump Officials of More Wrongful Deportations 4 min read The Perilous Path to Escape Gaza City Gazans have been forced to flee repeatedly. A visual essay follows the arduous and costly journey. Saher Alghorra for The New York Times Dado Galdieri for The New York Times Analysis Brazil Keeps Telling Trump to Get Lost Brazil, which just convicted former President Jair Bolsonaro over a coup attempt, is proving to be a test case for how to defy President Trump. 4 min read Advertisement SKIP ADVERTISEMENT Got a Tip? The Times offers several ways to send important information confidentially › T",English,,nytimes.com,https://www.nytimes.com/
Последние новости дня в России и мире сегодня - свежие новости на РБК,"rbc.group Главное Лента Эфир Главное Радио РБК Атаки беспилотников на Москву Военная операция на Украине Единый день голосования Революция зумеров в Непале Война Израиля с ХАМАС Еще сюжеты Еще сюжеты Посол Аргентины назвал условия отправки военного контингента на Украину &NoBreak; &NoBreak; Эксклюзив Минобороны рассказало о продвижении войск в Днепропетровской области Посол Аргентины: «Вступление в БРИКС не входит в наши приоритеты» Эксклюзив Bloomberg написал о риске Киева «зайти слишком далеко» в атаках на НПЗ У экс-замминистра обороны нашли часы с надписью «Такой Тимур Иванов один» США ввели санкции против компаний из КНР, Турции и ОАЭ за связи с Россией Сколько овощей есть, чтобы снизить риск смерти на 20% — Harvard Health NYT узнала, что мессенджер Discord стал центром принятия решений в Непале rbc.group Посол Аргентины заявил о прекращении «родильного туризма» из России Эксклюзив CNBC назвал дроны в Польше тактикой «нарезки салями» для проверки Запада «Ждем цунами, да?». Камчатские сейсмологи засняли землетрясение с вулкана Экс-глава Генштаба Израиля признал 10% населения Газы жертвами войны Ключевую ставку снизили: что будет с облигациями до конца 2025 года Посольство Хорватии отозвало визу российского борца Сефершаева перед ЧМ Как платить iPhone в России: 3 способа бесконтактной оплаты в 2025 году «Мне не нужны отношения»: как открыться новому после неудачного опыта Почти во всех регионах России проходят выборы. Что важно знать rbc.group Сейчас ищут Какой сегодня праздник Какой завтра праздник Осенний призыв 2025 БПЛА Лютый План Ковер Регионы России Дрон Баба-яга Что такое ТЦК Что такое буферная зона Газопровод Сила Сибири-2 Нефтепровод Дружба Самолет МС-21 Кто такие иноагенты в России Что было в файлах Эпштейна Что такое Зангезурский коридор rbc.group rbc.group rbc.group rbc.group Прямой эфир Ошибка воспроизведения видео. Пожалуйста, обновите ваш браузер. Новости Курс евро на 12 сентября EUR ЦБ: 99,74 (-0,09) Инвестиции, 11 сен, 18:48 Курс доллара на 12 сен",Russian,,rbc.ru,https://www.rbc.ru/
"RT - Breaking News, Russia News, World News and Video","العربية ESP РУС DE FR RS Where to watch Schedule RT News App Question more Ukraine threatening nuclear plants – Russian envoy live Russia & Former Soviet Union World News Business India Africa RT Features Analysis Opinion Entertainment Shows Projects Ukraine threatening nuclear plants – Russian envoy NATO kicks off military drill in response to ‘Russian violations’ The move follows Polish claims of Moscow’s drones violating its airspace, accusations the Kremlin has dismissed Latest Top Stories Nepal picks new interim prime minister Trump pledges investigation into Soros Tsunami alert follows 7.4 magnitude Kamchatka aftershock (VIDEOS) South Africa finalizing appointment of new ambassador to US Can India and China finally bridge their deep divides? ANALYSIS Kiev’s special forces strike Russian rescue ship This Western country depends on China, but is obsessed with demonizing it Opinion Kirk murder suspect apprehended – Tyler Robinson’s mugshot published (PHOTO) There is a country where the British army has retained impunity for years. Soldiers use it to escape their crimes FEATURE Oxford debating club president-elect celebrated Charlie Kirk’s murder Poland dismisses media claims of troop deployment to Ukraine The Middle East is being given a golden chance to prosper – can it unite and seize it? ANALYSIS Top stories US to press G7 on seizing frozen Russian assets – Bloomberg The immobilized funds could be used to finance Ukraine, according to Washington’s proposal Latest Top Stories Do you know where are they now? The lives and deaths of America’s assassins LIST Ukraine threatening nuclear plants – Russian envoy The future belongs to love and friendship – Putin Suspected Charlie Kirk assassin in custody – Trump Telegram founder calls Charlie Kirk’s murder ‘assault on free speech’ US working to replace Russian gas sales to Europe – energy secretary Peace talks with Kiev on hold – Kremlin FEATURE Protesters spoke, NGOs pulled strings: The untold story of Nepal’s upheava",Russian,,rt.com,https://www.rt.com/
